{
  "decision": "approved",
  "phase": "guardrail-baseline",
  "maturity_classification": "v1-foundation",
  "blocking_issues": [],
  "accepted_items": [
    "guardrail-v1"
  ],
  "required_next_action": "awaiting manual trigger",
  "next_instruction_for_hermes": "Proceed to next phase when ready",
  "should_continue": false
}